"MuiTypography-root href","MuiTypography-root","MuiTypography-root 2","MuiTypography-root 3","search-result-tagline__bullet","MuiTypography-root 4","visually-hidden","MuiTypography-root 6","search-result-feature__body","search-result-feature__body 2","search-result-feature__teaser","search-result-feature__teaser-text","niche__grade","visually-hidden 2","MuiTypography-root 7","MuiTypography-root 8","MuiTypography-root 9","MuiTypography-root 10","visually-hidden 3","visually-hidden 4","visually-hidden 5","visually-hidden 6","visually-hidden 7","visually-hidden 8","visually-hidden 9","visually-hidden 10","visually-hidden 11","visually-hidden 12","visually-hidden 13","visually-hidden 14","visually-hidden 15","MuiTypography-root 11","MuiTypography-root href 2","MuiTypography-root 12","MuiTypography-root href 3","MuiTypography-root 13","MuiTypography-root href 4","add-to-list__text"
"https://www.niche.com/colleges/yale-university/","#1 Best Colleges in America","Yale University","New Haven, CT","·","4 Year","Rating 4.03 out of 5","1,059 reviews","Yale is amazing overall! Campus is full of activities and there's always something to do. New Haven may not be the greatest city in America, but that just makes students be more active on campus and creates a sense of community! Yale also has the perfect balance of academics, extracurriculars, and social life, or as we like to think about it, the 8/8/8 rule: 8 hours of studying, 8 of sleep, and 8 of social life.","Freshman:","...","Read 1,059 reviews","A+","grade","Overall Niche Grade","Acceptance rate 5%","Net price $18,647","SAT range 1500-1580","#1 Best Colleges in America.","Yale University","Blue checkmark.","4 Year,","NEW HAVEN, CT,","1059 Niche users give it an average review of 4 stars.","Featured Review: Freshman says","Yale is amazing overall! Campus is full of activities and there's always something to do. New Haven may not be the greatest city in America, but that just makes students be more active on campus and....","Read 1059 reviews.","Overall Niche Grade: A+,","Acceptance Rate: 5%,","Net Price: $18,647,","SAT Range: 1500-1580,","Will you get in?","https://www.niche.com/colleges/yale-university/#scatterplot","Compare","https://www.niche.com/colleges/compare/?type=college&colleges=yale-university","Virtual tour","http://admissions.yale.edu/virtual-tour","Add to List"
"https://www.niche.com/colleges/stanford-university/","#2 Best Colleges in America","Stanford University","Stanford, CA","·","4 Year","Rating 4.1 out of 5","1,288 reviews","Attending Stanford has been a mix of excitement and challenges. Going to games is a blast, with plenty of sports activities. Professors are generally great but lean politically one way, limiting viewpoint diversity. As a research-focused institution, one-on-one time with professors is limited, though humanities professors are more approachable. Lecturers are decent, reflecting the research emphasis.

Campus life can be slow, so finding your group is crucial. The campus is huge and beautiful, with great weather and all necessary amenities. The social scene is limited, and Palo Alto, though affluent, is not very exciting. San Francisco and Oakland are 45 minutes to an hour away, offering more entertainment options. However, most students stay on campus due to the distance and heavy workload, contributing to the ""Stanford bubble."" Overall, Stanford offers great opportunities, but you need to find your niche to make the most of it.","Graduate Student:","...","Read 1,288 reviews","A+","grade","Overall Niche Grade","Acceptance rate 4%","Net price $18,279","SAT range 1500-1580","#2 Best Colleges in America.","Stanford University","4 Year,","STANFORD, CA,","1288 Niche users give it an average review of 4.1 stars.","Featured Review: Graduate Student says","Read 1288 reviews.","Attending Stanford has been a mix of excitement and challenges. Going to games is a blast, with plenty of sports activities. Professors are generally great but lean politically one way, limiting...Campus life can be slow, so finding your group is crucial. The campus is huge and beautiful, with great weather and all necessary amenities. The social scene is limited, and Palo Alto, though....","Overall Niche Grade: A+,","Acceptance Rate: 4%,","Net Price: $18,279,","SAT Range: 1500-1580,","","Will you get in?","https://www.niche.com/colleges/stanford-university/#scatterplot","Compare","https://www.niche.com/colleges/compare/?type=college&colleges=stanford-university","","","Add to List"
"https://www.niche.com/colleges/massachusetts-institute-of-technology/","#3 Best Colleges in America","Massachusetts Institute of Technology","Cambridge, MA","·","4 Year","Rating 4.17 out of 5","664 reviews","This is a great university for expanding your horizons, especially if you are from a small area. The initial year gives a lot of freedom for exploring options for your major, and there are great support systems from both students and administration that help adjust to being an MIT student. There are plenty of readily available resources in various departments that allow for personal or academic exploration without having to worry about cost.","Junior:","...","Read 664 reviews","A+","grade","Overall Niche Grade","Acceptance rate 4%","Net price $20,232","SAT range 1530-1580","#3 Best Colleges in America.","Massachusetts Institute of Technology","4 Year,","CAMBRIDGE, MA,","664 Niche users give it an average review of 4.2 stars.","Featured Review: Junior says","Read 664 reviews.","This is a great university for expanding your horizons, especially if you are from a small area. The initial year gives a lot of freedom for exploring options for your major, and there are great....","Overall Niche Grade: A+,","Acceptance Rate: 4%,","Net Price: $20,232,","SAT Range: 1530-1580,","","Will you get in?","https://www.niche.com/colleges/massachusetts-institute-of-technology/#scatterplot","Compare","https://www.niche.com/colleges/compare/?type=college&colleges=massachusetts-institute-of-technology","","","Add to List"
"","Find your best fit","Take the College Quiz","Tell us what matters most to you and we'll create a custom list of schools tailored to fit your needs.","","","","","","","","","","","","","","","","","","","","","","","","","","","","","","","","","",""
"","Find Student Loan Options","4 Ways to Pay for College","2024 Best Value Colleges","","","","","","","","","","","","","","","","","","","","","","","","","","","","","","","","","",""
"https://www.niche.com/colleges/harvard-university/","#4 Best Colleges in America","Harvard University","Cambridge, MA","·","4 Year","Rating 4.16 out of 5","850 reviews","Attending Harvard College was transformative. The housing system fostered a strong sense of community, facilitating academic support and social interaction. The rigorous academics, led by renowned faculty, challenged me to think critically and pursue my interests. Harvard's commitment to diversity enriched my experience, and the vibrant location in Cambridge provided endless opportunities for exploration and growth. Harvard College offered an unparalleled experience that has left an indelible mark on my life.","Alum:","...","Read 850 reviews","A+","grade","Overall Niche Grade","Acceptance rate 3%","Net price $19,491","SAT range 1490-1580","#4 Best Colleges in America.","Harvard University","4 Year,","CAMBRIDGE, MA,","850 Niche users give it an average review of 4.2 stars.","Featured Review: Alum says","Read 850 reviews.","Attending Harvard College was transformative. The housing system fostered a strong sense of community, facilitating academic support and social interaction. The rigorous academics, led by renowned....","Overall Niche Grade: A+,","Acceptance Rate: 3%,","Net Price: $19,491,","SAT Range: 1490-1580,","","Will you get in?","https://www.niche.com/colleges/harvard-university/#scatterplot","Compare","https://www.niche.com/colleges/compare/?type=college&colleges=harvard-university","Virtual tour","https://college.harvard.edu/admissions/explore-harvard/virtual-tour","Add to List"
"https://www.niche.com/colleges/princeton-university/","#5 Best Colleges in America","Princeton University","Princeton, NJ","·","4 Year","Rating 3.98 out of 5","473 reviews","Princeton University is certainly an academically rigorous college. It attracts students who hold themselves to high standards which, due to grade deflation, adds to the stress of most students. The campus is beautiful in the more historic part of campus. The newer buildings are very clean and there are several food options. I don’t ever feel the need to snack with the amount of options I have in the undergraduate meal plan. Many of the student organizations are wonderful and everyone is very passionate about their field. It is certainly not an athletic school but alumni are extremely passionate about Princeton pride.","Sophomore:","...","Read 473 reviews","A+","grade","Overall Niche Grade","Acceptance rate 6%","Net price $18,698","SAT range 1490-1580","#5 Best Colleges in America.","Princeton University","Blue checkmark.","4 Year,","PRINCETON, NJ,","473 Niche users give it an average review of 4 stars.","Featured Review: Sophomore says","Princeton University is certainly an academically rigorous college. It attracts students who hold themselves to high standards which, due to grade deflation, adds to the stress of most students. The....","Read 473 reviews.","Overall Niche Grade: A+,","Acceptance Rate: 6%,","Net Price: $18,698,","SAT Range: 1490-1580,","Will you get in?","https://www.niche.com/colleges/princeton-university/#scatterplot","Compare","https://www.niche.com/colleges/compare/?type=college&colleges=princeton-university","","","Add to List"
"https://www.niche.com/colleges/columbia-university/","#6 Best Colleges in America","Columbia University","New York, NY","·","4 Year","Rating 3.82 out of 5","1,366 reviews","As a biochemistry student at Columbia University, my experience was extraordinary. The Core Curriculum was a highlight, exposing me to literature, philosophy, art history, and music. This interdisciplinary approach enriched my understanding and fostered critical thinking and analytical writing skills.

Beyond academics, I loved engaging with the community through Peer Health Exchange (now S-HEAL), where I educated high school students on health and wellness. This experience enhanced my communication skills and deepened my commitment to public health.

Writing for The Spectator allowed me to make scientific concepts accessible, improving my ability to articulate ideas clearly. Additionally, Columbia’s vibrant arts scene, from Miller Theatre performances to Wallach Art Gallery exhibitions, provided a rich cultural balance to my studies.

Overall, Columbia offered a holistic education, blending rigorous science, arts, and community involvement, preparing me well for the future.","Alum:","...","Read 1,366 reviews","A+","grade","Overall Niche Grade","Acceptance rate 4%","Net price $22,058","SAT range 1490-1580","#6 Best Colleges in America.","Columbia University","Blue checkmark.","4 Year,","NEW YORK, NY,","1366 Niche users give it an average review of 3.8 stars.","Featured Review: Alum says","As a biochemistry student at Columbia University, my experience was extraordinary. The Core Curriculum was a highlight, exposing me to literature, philosophy, art history, and music. This...Beyond academics, I loved engaging with the community through Peer Health Exchange (now S-HEAL), where I educated high school students on health and wellness. This experience enhanced my...Writing for The Spectator allowed me to make scientific concepts accessible, improving my ability to articulate ideas clearly. Additionally, Columbia’s vibrant arts scene, from Miller Theatre...Overall, Columbia offered a holistic education, blending rigorous science, arts, and community involvement, preparing me well for the future..","Read 1366 reviews.","Overall Niche Grade: A+,","Acceptance Rate: 4%,","Net Price: $22,058,","SAT Range: 1490-1580,","Will you get in?","https://www.niche.com/colleges/columbia-university/#scatterplot","Compare","https://www.niche.com/colleges/compare/?type=college&colleges=columbia-university","Virtual tour","https://undergrad.admissions.columbia.edu/visit/virtual-tours","Add to List"
"","Will you get in?","Understand your chances of getting accepted into any college in the country, and it's completely free","","","","","","","","","","","","","","","","","","","","","","","","","","","","","","","","","","",""
"https://www.niche.com/colleges/university-of-pennsylvania/","#7 Best Colleges in America","University of Pennsylvania","Philadelphia, PA","·","4 Year","Rating 3.9 out of 5","1,363 reviews","It's important to acknowledge that college experiences vary greatly from person to person, and while some may face challenges or difficulties, others may find their time in college to be transformative and rewarding. Instead of focusing on the negatives, perhaps you could consider exploring constructive criticism or discussing specific areas for improvement in the college experience. This approach allows for a more balanced and productive discussion that can lead to positive changes and improvements in the education system. If you have specific concerns about your college experience, it might be helpful to address them directly with the appropriate channels within your institution or seek support from counselors or advisors. Remember, challenges are a natural part of any educational journey, and there are often resources available to help navigate them.","Freshman:","...","Read 1,363 reviews","A+","grade","Overall Niche Grade","Acceptance rate 7%","Net price $26,123","SAT range 1500-1570","#7 Best Colleges in America.","University of Pennsylvania","Blue checkmark.","4 Year,","PHILADELPHIA, PA,","1363 Niche users give it an average review of 3.9 stars.","Featured Review: Freshman says","It's important to acknowledge that college experiences vary greatly from person to person, and while some may face challenges or difficulties, others may find their time in college to be....","Read 1363 reviews.","Overall Niche Grade: A+,","Acceptance Rate: 7%,","Net Price: $26,123,","SAT Range: 1500-1570,","Will you get in?","https://www.niche.com/colleges/university-of-pennsylvania/#scatterplot","Compare","https://www.niche.com/colleges/compare/?type=college&colleges=university-of-pennsylvania","Virtual tour","https://key.admissions.upenn.edu/portal/live-tours","Add to List"
"https://www.niche.com/colleges/dartmouth-college/","#8 Best Colleges in America","Dartmouth College","Hanover, NH","·","4 Year","Rating 3.88 out of 5","748 reviews","My experience at Dartmouth has been great so far. The education is high quality and so are the professors. There are great opportunities for practical work and research. And the student body and campus life is lively and welcoming. The university is not perfect and the frat culture is very big here, but it is a wonderful place to be.","Sophomore:","...","Read 748 reviews","A+","grade","Overall Niche Grade","Acceptance rate 6%","Net price $19,208","SAT range 1500-1580","#8 Best Colleges in America.","Dartmouth College","Blue checkmark.","4 Year,","HANOVER, NH,","748 Niche users give it an average review of 3.9 stars.","Featured Review: Sophomore says","My experience at Dartmouth has been great so far. The education is high quality and so are the professors. There are great opportunities for practical work and research. And the student body and....","Read 748 reviews.","Overall Niche Grade: A+,","Acceptance Rate: 6%,","Net Price: $19,208,","SAT Range: 1500-1580,","Will you get in?","https://www.niche.com/colleges/dartmouth-college/#scatterplot","Compare","https://www.niche.com/colleges/compare/?type=college&colleges=dartmouth-college","","","Add to List"
"https://www.niche.com/colleges/rice-university/","#9 Best Colleges in America","Rice University","Houston, TX","·","4 Year","Rating 4.09 out of 5","1,123 reviews","Going to Rice University to attend the Shepherd School of Music at a graduate level is an experience separate from the rest of Rice. The Opera Department at Rice University has been one of the best programs in the United States producing incredible singers in the industry for a while now. Financial aid has been decreasing from full rides to having to pay a couple of thousands to attend +fees for a Master of Music. It is case by case, however.

Pros: BEAUTIFUL theater that is incredible to sing in, program's very YAP reminiscent (in good and bad ways), world-class faculty, great networking opportunity, masterclasses/private audition opportunities

Cons: your soul/free-time belongs to the Opera Department; if a release conflicts with the opera schedule, tough luck; there have been many issues with casting opportunities/favoritism; if you're a person of color, be prepared to be a token on all promo material; TOO many irrelevant time-consuming academics; having a car is a MUST in Houston","Graduate Student:","...","Read 1,123 reviews","A+","grade","Overall Niche Grade","Acceptance rate 9%","Net price $19,902","SAT range 1490-1570","#9 Best Colleges in America.","Rice University","Blue checkmark.","4 Year,","HOUSTON, TX,","1123 Niche users give it an average review of 4.1 stars.","Featured Review: Graduate Student says","Going to Rice University to attend the Shepherd School of Music at a graduate level is an experience separate from the rest of Rice. The Opera Department at Rice University has been one of the best...Pros: BEAUTIFUL theater that is incredible to sing in, program's very YAP reminiscent (in good and bad ways), world-class faculty, great networking opportunity, masterclasses/private audition...Cons: your soul/free-time belongs to the Opera Department; if a release conflicts with the opera schedule, tough luck; there have been many issues with casting opportunities/favoritism; if you're a....","Read 1123 reviews.","Overall Niche Grade: A+,","Acceptance Rate: 9%,","Net Price: $19,902,","SAT Range: 1490-1570,","Will you get in?","https://www.niche.com/colleges/rice-university/#scatterplot","Compare","https://www.niche.com/colleges/compare/?type=college&colleges=rice-university","Virtual tour","https://experience.rice.edu/","Add to List"
"https://www.niche.com/colleges/brown-university/","#10 Best Colleges in America","Brown University","Providence, RI","·","4 Year","Rating 3.85 out of 5","1,085 reviews","I absolutely love Brown. The academics are amazing, the people are kind and fun, there are amazing professors and top-notch speakers who come in from around the world. The open curriculum is incredible and the student body all care about what they are doing and about the world and what is happening in it. People aren't afraid to protest for the causes they care about and it's also just absolutely beautiful. It's amazing. I would say that not having air conditioning can be pretty rough for a while. And the administration doesn't always feel like it truly cares about the students, but overall, so far I think it's been amazing.","Sophomore:","...","Read 1,085 reviews","A+","grade","Overall Niche Grade","Acceptance rate 5%","Net price $26,723","SAT range 1490-1580","#10 Best Colleges in America.","Brown University","Blue checkmark.","4 Year,","PROVIDENCE, RI,","1085 Niche users give it an average review of 3.8 stars.","Featured Review: Sophomore says","I absolutely love Brown. The academics are amazing, the people are kind and fun, there are amazing professors and top-notch speakers who come in from around the world. The open curriculum is....","Read 1085 reviews.","Overall Niche Grade: A+,","Acceptance Rate: 5%,","Net Price: $26,723,","SAT Range: 1490-1580,","Will you get in?","https://www.niche.com/colleges/brown-university/#scatterplot","Compare","https://www.niche.com/colleges/compare/?type=college&colleges=brown-university","Virtual tour","https://youvis.it/maTKj1","Add to List"
"https://www.niche.com/colleges/harvey-mudd-college/","#11 Best Colleges in America","Harvey Mudd College","Claremont, CA","·","4 Year","Rating 3.79 out of 5","157 reviews","I'm an incoming freshman! I was accepted to the Class of 2028 and I'll likely be studying either engineering or math+compsci. I attended Admitted Student Day 2 weeks ago on campus and the current students as well as the professors are extremely kind, humble, knowledgeable, and always willing to help.","Other:","...","Read 157 reviews","A+","grade","Overall Niche Grade","Acceptance rate 13%","Net price $39,850","SAT range 1480-1560","#11 Best Colleges in America.","Harvey Mudd College","Blue checkmark.","4 Year,","CLAREMONT, CA,","157 Niche users give it an average review of 3.8 stars.","Featured Review: Other says","I'm an incoming freshman! I was accepted to the Class of 2028 and I'll likely be studying either engineering or math+compsci. I attended Admitted Student Day 2 weeks ago on campus and the current....","Read 157 reviews.","Overall Niche Grade: A+,","Acceptance Rate: 13%,","Net Price: $39,850,","SAT Range: 1480-1560,","Will you get in?","https://www.niche.com/colleges/harvey-mudd-college/#scatterplot","Compare","https://www.niche.com/colleges/compare/?type=college&colleges=harvey-mudd-college","","","Add to List"
"https://www.niche.com/colleges/georgetown-university/","#12 Best Colleges in America","Georgetown University","Washington, DC","·","4 Year","Rating 3.81 out of 5","1,279 reviews","Amazing campus, beautiful area surrounding campus with lots of connections to history! GU boasts a strong reputation for academic rigor and excellence across various disciplines, including law, business, international relations, and public policy. Situated in Washington, D.C., Georgetown benefits from its proximity to numerous government agencies, international organizations, and cultural institutions, offering unparalleled opportunities for internships, research, and networking. I love the diverse and inclusive community, attracting students and faculty worldwide. Diversity enriches the cross-cultural understanding. Georgetown has a vast and influential alumni network, providing students with valuable connections and opportunities for mentorship and career advancement. Rooted in its Jesuit tradition, Georgetown emphasizes the importance of ethical leadership and service to others, instilling in students a sense of responsibility and commitment to making a positive impact on society.","Freshman:","...","Read 1,279 reviews","A+","grade","Overall Niche Grade","Acceptance rate 12%","Net price $35,566","SAT range 1410-1560","#12 Best Colleges in America.","Georgetown University","4 Year,","WASHINGTON, DC,","1279 Niche users give it an average review of 3.8 stars.","Featured Review: Freshman says","Read 1279 reviews.","Amazing campus, beautiful area surrounding campus with lots of connections to history! GU boasts a strong reputation for academic rigor and excellence across various disciplines, including law,....","Overall Niche Grade: A+,","Acceptance Rate: 12%,","Net Price: $35,566,","SAT Range: 1410-1560,","","Will you get in?","https://www.niche.com/colleges/georgetown-university/#scatterplot","Compare","https://www.niche.com/colleges/compare/?type=college&colleges=georgetown-university","Virtual tour","https://uadmissions.georgetown.edu/visiting/virtual-tour/","Add to List"
"","Find Student Loan Options","4 Ways to Pay for College","2024 Best College Food","","","","","","","","","","","","","","","","","","","","","","","","","","","","","","","","","",""
"https://www.niche.com/colleges/duke-university/","#13 Best Colleges in America","Duke University","Durham, NC","·","4 Year","Rating 3.94 out of 5","1,212 reviews","Duke is a great community! While classes were difficult, challenged us to think critically, and were competitive by nature, I believe Duke students worked hard to help each other learn and succeed. Being in a small town like Durham and living on campus for 3 years, Duke fosters a strong sense of community unique to other universities.","Alum:","...","Read 1,212 reviews","A+","grade","Overall Niche Grade","Acceptance rate 6%","Net price $23,694","SAT range 1490-1570","#13 Best Colleges in America.","Duke University","Blue checkmark.","4 Year,","DURHAM, NC,","1212 Niche users give it an average review of 3.9 stars.","Featured Review: Alum says","Duke is a great community! While classes were difficult, challenged us to think critically, and were competitive by nature, I believe Duke students worked hard to help each other learn and succeed.....","Read 1212 reviews.","Overall Niche Grade: A+,","Acceptance Rate: 6%,","Net Price: $23,694,","SAT Range: 1490-1570,","Will you get in?","https://www.niche.com/colleges/duke-university/#scatterplot","Compare","https://www.niche.com/colleges/compare/?type=college&colleges=duke-university","Virtual tour","https://www.youvisit.com/tour/duke","Add to List"
