"MuiTypography-root href","MuiTypography-root","MuiTypography-root 2","MuiTypography-root 3","search-result-tagline__bullet","MuiTypography-root 4","visually-hidden","MuiTypography-root 6","search-result-feature__body","search-result-feature__body 2","search-result-feature__teaser","search-result-feature__teaser-text","niche__grade","visually-hidden 2","MuiTypography-root 7","MuiTypography-root 8","MuiTypography-root 9","MuiTypography-root 10","visually-hidden 3","visually-hidden 4","visually-hidden 5","visually-hidden 6","visually-hidden 7","visually-hidden 8","visually-hidden 9","visually-hidden 10","visually-hidden 11","visually-hidden 12","visually-hidden 13","visually-hidden 14","visually-hidden 15","MuiTypography-root 11","MuiTypography-root href 2","MuiTypography-root 12","MuiTypography-root href 3","MuiTypography-root 13","MuiTypography-root href 4","add-to-list__text"
"https://www.niche.com/colleges/vanderbilt-university/","#14 Best Colleges in America","Vanderbilt University","Nashville, TN","·","4 Year","Rating 4.02 out of 5","1,356 reviews","I have overall had a great experience with Vanderbilt University, and I am truly sad that it is my last year coming up in the fall. I think that community is something that Vanderbilt does well, as everyone is so collaborative and kind! I think what needs to change is the Chancellor's office needs to hear student voices. Often times, his office makes really weird and sometimes dumb decisions without considering what it will look like for students, and it is really frustrating to not have our voices heard and listened to.","Senior:","...","Read 1,356 reviews","A+","grade","Overall Niche Grade","Acceptance rate 7%","Net price $25,606","SAT range 1490-1570","#14 Best Colleges in America.","Vanderbilt University","Blue checkmark.","4 Year,","NASHVILLE, TN,","1356 Niche users give it an average review of 4 stars.","Featured Review: Senior says","I have overall had a great experience with Vanderbilt University, and I am truly sad that it is my last year coming up in the fall. I think that community is something that Vanderbilt does well, as....","Read 1356 reviews.","Overall Niche Grade: A+,","Acceptance Rate: 7%,","Net Price: $25,606,","SAT Range: 1490-1570,","Will you get in?","https://www.niche.com/colleges/vanderbilt-university/#scatterplot","Compare","https://www.niche.com/colleges/compare/?type=college&colleges=vanderbilt-university","Virtual tour","https://admissions.vanderbilt.edu/tour/","Add to List"
"https://www.niche.com/colleges/northwestern-university/","#15 Best Colleges in America","Northwestern University","Evanston, IL","·","4 Year","Rating 3.7 out of 5","1,495 reviews","Attending Northwestern University allows me to be of service to people in my community. Its strong emphasis on community service and social justice aligns perfectly with my goals of advocating for systemic change. By participating in Northwestern’s outreach programs and leveraging its vast network, I bring attention to the issues plaguing our community and work towards sustainable solutions. 

The process to switch majors within McCormick is seamless. Starting at Weignberg my freshman year, I had to wait a whole quarter before switching schools and major.","Junior:","...","Read 1,495 reviews","A+","grade","Overall Niche Grade","Acceptance rate 7%","Net price $22,095","SAT range 1490-1570","#15 Best Colleges in America.","Northwestern University","Blue checkmark.","4 Year,","EVANSTON, IL,","1495 Niche users give it an average review of 3.7 stars.","Featured Review: Junior says","Attending Northwestern University allows me to be of service to people in my community. Its strong emphasis on community service and social justice aligns perfectly with my goals of advocating for...The process to switch majors within McCormick is seamless. Starting at Weignberg my freshman year, I had to wait a whole quarter before switching schools and major..","Read 1495 reviews.","Overall Niche Grade: A+,","Acceptance Rate: 7%,","Net Price: $22,095,","SAT Range: 1490-1570,","Will you get in?","https://www.niche.com/colleges/northwestern-university/#scatterplot","Compare","https://www.niche.com/colleges/compare/?type=college&colleges=northwestern-university","","","Add to List"
"https://www.niche.com/colleges/washington-university-in-st-louis/","#16 Best Colleges in America","Washington University in St. Louis","Saint Louis, MO","·","4 Year","Rating 4.11 out of 5","1,578 reviews","My experience with Washington University in St. Louis has been adventurous so far. I have gotten the amazing opportunity to work with brilliant students and professors from across the world. The diverse nature and vivid scenery of the campus never fails to captivate my attention and appreciation for my university. I am constantly being challenged and pushed to become a better student, intern, and overall person which is exactly what I look for in a college. GO BEARS!","Junior:","...","Read 1,578 reviews","A+","grade","Overall Niche Grade","Acceptance rate 12%","Net price $23,432","SAT range 1500-1570","#16 Best Colleges in America.","Washington University in St. Louis","Blue checkmark.","4 Year,","SAINT LOUIS, MO,","1578 Niche users give it an average review of 4.1 stars.","Featured Review: Junior says","My experience with Washington University in St. Louis has been adventurous so far. I have gotten the amazing opportunity to work with brilliant students and professors from across the world. The....","Read 1578 reviews.","Overall Niche Grade: A+,","Acceptance Rate: 12%,","Net Price: $23,432,","SAT Range: 1500-1570,","Will you get in?","https://www.niche.com/colleges/washington-university-in-st-louis/#scatterplot","Compare","https://www.niche.com/colleges/compare/?type=college&colleges=washington-university-in-st-louis","Virtual tour","https://www.youvisit.com/tour/wustl/139513","Add to List"
"https://www.niche.com/colleges/california-institute-of-technology/","#17 Best Colleges in America","California Institute of Technology","Pasadena, CA","·","4 Year","Rating 3.97 out of 5","133 reviews","I like the campus most , students activities , diverse programs of alumni and dorms and libraries . overall experiences are very good .","Other:","...","Read 133 reviews","A+","grade","Overall Niche Grade","Acceptance rate 3%","Net price $20,755","SAT range 1530-1580","#17 Best Colleges in America.","California Institute of Technology","Blue checkmark.","4 Year,","PASADENA, CA,","133 Niche users give it an average review of 4 stars.","Featured Review: Other says","I like the campus most , students activities , diverse programs of alumni and dorms and libraries . overall experiences are very good ..","Read 133 reviews.","Overall Niche Grade: A+,","Acceptance Rate: 3%,","Net Price: $20,755,","SAT Range: 1530-1580,","Will you get in?","https://www.niche.com/colleges/california-institute-of-technology/#scatterplot","Compare","https://www.niche.com/colleges/compare/?type=college&colleges=california-institute-of-technology","Virtual tour","https://www.youvisit.com/tour/caltech","Add to List"
"https://www.niche.com/colleges/pomona-college/","#18 Best Colleges in America","Pomona College","Claremont, CA","·","4 Year","Rating 4.23 out of 5","426 reviews","Pomona is the best place if you're into a small college environment, down-to-earth really intellectual people, and are open to learn new subjects! I have grown so much in my semesters here, and I feel set up to succeed in the future. The college has free food and events everywhere, and there's always something to do alongside your classes (and, if not, you can always lay out in the beautiful sun). Would highly recommend going on On-The-Loose trips, where you can go on backpacking trips, overnight beach trips, etc. Pomona has been the perfect fit, and I couldn't ask for a better college experience. Oh, and the professors? They are amazing! Super supportive and, while it is a very rigorous place, the professors are rooting for you to achieve.","Sophomore:","...","Read 426 reviews","A+","grade","Overall Niche Grade","Acceptance rate 7%","Net price $19,962","SAT range 1480-1560","#18 Best Colleges in America.","Pomona College","Blue checkmark.","4 Year,","CLAREMONT, CA,","426 Niche users give it an average review of 4.2 stars.","Featured Review: Sophomore says","Pomona is the best place if you're into a small college environment, down-to-earth really intellectual people, and are open to learn new subjects! I have grown so much in my semesters here, and I....","Read 426 reviews.","Overall Niche Grade: A+,","Acceptance Rate: 7%,","Net Price: $19,962,","SAT Range: 1480-1560,","Will you get in?","https://www.niche.com/colleges/pomona-college/#scatterplot","Compare","https://www.niche.com/colleges/compare/?type=college&colleges=pomona-college","Virtual tour","https://www.youtube.com/watch?v=0yM4MSU4eI0","Add to List"
"https://www.niche.com/colleges/university-of-california-los-angeles/","#19 Best Colleges in America","University of California - Los Angeles","Los Angeles, CA","·","4 Year","Rating 3.98 out of 5","5,609 reviews","As with any college, the experience is what you make of it. UCLA just presents a lot of diversity in terms of the experiences that you can have. You can get your party fix in on Thursdays at frat row, kickbacks through cultural or professional organizations, or even a warehouse rave in the Arts District. Academically, there are plenty of opportunities for research and internships. It can be difficult to get into certain classes until you are in your 3rd or 4th year, though. Living on campus is really helpful for finding friends and the food is definitely a blow-out compared to other schools I've visited. Only downside is that housing in general is expensive due to the area, so you'll likely be sharing a room and living on a budget!","Alum:","...","Read 5,609 reviews","A+","grade","Overall Niche Grade","Acceptance rate 9%","Net price $16,999","SAT range —","#19 Best Colleges in America.","University of California - Los Angeles","Blue checkmark.","4 Year,","LOS ANGELES, CA,","5609 Niche users give it an average review of 4 stars.","Featured Review: Alum says","As with any college, the experience is what you make of it. UCLA just presents a lot of diversity in terms of the experiences that you can have. You can get your party fix in on Thursdays at frat....","Read 5609 reviews.","Overall Niche Grade: A+,","Acceptance Rate: 9%,","Net Price: $16,999,","","Will you get in?","https://www.niche.com/colleges/university-of-california-los-angeles/#scatterplot","Compare","https://www.niche.com/colleges/compare/?type=college&colleges=university-of-california-los-angeles","","","Add to List"
"https://www.niche.com/colleges/carnegie-mellon-university/","#20 Best Colleges in America","Carnegie Mellon University","Pittsburgh, PA","·","4 Year","Rating 3.71 out of 5","1,483 reviews","Attending CMU has been an incredibly enriching experience. The academic programs are robust and rigorous, providing a strong foundation in both theory and practical application. The faculty are not only experts in their fields but also dedicated mentors who genuinely care about student success.

Beyond academics, student life at CMU is vibrant and inclusive. There are countless clubs, organizations, and activities that cater to a wide range of interests, ensuring that everyone finds their niche. The campus itself is beautiful and well-maintained, offering a perfect blend of historic charm and modern facilities.

The university community is warm and welcoming, fostering a sense of belonging and camaraderie among students. There are always events and gatherings, from cultural festivals to sporting events, making it easy to meet new people and build lasting friendships. Overall, my time at CMU has been nothing short of exceptional, both academically and personally.","Alum:","...","Read 1,483 reviews","A+","grade","Overall Niche Grade","Acceptance rate 11%","Net price $33,499","SAT range 1490-1570","#20 Best Colleges in America.","Carnegie Mellon University","Blue checkmark.","4 Year,","PITTSBURGH, PA,","1483 Niche users give it an average review of 3.7 stars.","Featured Review: Alum says","Attending CMU has been an incredibly enriching experience. The academic programs are robust and rigorous, providing a strong foundation in both theory and practical application. The faculty are not...Beyond academics, student life at CMU is vibrant and inclusive. There are countless clubs, organizations, and activities that cater to a wide range of interests, ensuring that everyone finds their...The university community is warm and welcoming, fostering a sense of belonging and camaraderie among students. There are always events and gatherings, from cultural festivals to sporting events,....","Read 1483 reviews.","Overall Niche Grade: A+,","Acceptance Rate: 11%,","Net Price: $33,499,","SAT Range: 1490-1570,","Will you get in?","https://www.niche.com/colleges/carnegie-mellon-university/#scatterplot","Compare","https://www.niche.com/colleges/compare/?type=college&colleges=carnegie-mellon-university","Virtual tour","https://www.cmu.edu/admission/visit/online-visit","Add to List"
"https://www.niche.com/colleges/university-of-michigan-ann-arbor/","#21 Best Colleges in America","University of Michigan - Ann Arbor","Ann Arbor, MI","·","4 Year","Rating 3.96 out of 5","4,737 reviews","Entering college, I was head-over-heels excited to attend my dream school: University of Michigan. What I did not realize were the many factors that came along with starting this new path of life -- living away from home, party culture, the football game frenzy, endless schoolwork, and the underlying pressure of having to make connections and network with others. Although these aspects seemed as though they were going to slowly but surely destroy me, I found great solace in studying (and the occasional bi-weekly matcha latte from Sweetwaters:)). The vast amount of resources in any field from ballet to biochemistry was something truly unique and a gift for someone interested in a multidisciplinary career like me. Further the research opportunities available to even first year students were abundant in every field. One thing I would like to see change is the resources available for people struggling to make friends and find a community. However, I hope my experience improves!","Sophomore:","...","Read 4,737 reviews","A+","grade","Overall Niche Grade","Acceptance rate 18%","Net price $19,318","SAT range 1350-1530","#21 Best Colleges in America.","University of Michigan - Ann Arbor","Blue checkmark.","4 Year,","ANN ARBOR, MI,","4737 Niche users give it an average review of 4 stars.","Featured Review: Sophomore says","Entering college, I was head-over-heels excited to attend my dream school: University of Michigan. What I did not realize were the many factors that came along with starting this new path of life --....","Read 4737 reviews.","Overall Niche Grade: A+,","Acceptance Rate: 18%,","Net Price: $19,318,","SAT Range: 1350-1530,","Will you get in?","https://www.niche.com/colleges/university-of-michigan-ann-arbor/#scatterplot","Compare","https://www.niche.com/colleges/compare/?type=college&colleges=university-of-michigan-ann-arbor","","","Add to List"
"https://www.niche.com/colleges/cornell-university/","#22 Best Colleges in America","Cornell University","Ithaca, NY","·","4 Year","Rating 3.79 out of 5","2,088 reviews","I am currently a junior and really enjoy my time at Cornell so far. There is a lot of traditions that are fun to participate in such as hockey games and slope day. The academics can be really stressful and a bit overwhelming especially if you have other big time commitments outside of school but it's really helped me become more prepared for internships and life outside campus if I'm being honest. I've made a lot of good friends here and people are generally nice, although there is definetely some cliqueness in some groups. A lot of people say Ithaca/location of the school aren't ideal but for me it's perfect as I grew up surrounded by nature and Cornell gives a lot of access to outdoor activities like rock climbing, hiking, and biking to name a few. It also gets really pretty during fall, spring, and snows but the winter kind of drags on which is pretty frustrating especially if you're not used to having cold winters.","Junior:","...","Read 2,088 reviews","A+","grade","Overall Niche Grade","Acceptance rate 7%","Net price $26,060","SAT range 1470-1570","#22 Best Colleges in America.","Cornell University","Blue checkmark.","4 Year,","ITHACA, NY,","2088 Niche users give it an average review of 3.8 stars.","Featured Review: Junior says","I am currently a junior and really enjoy my time at Cornell so far. There is a lot of traditions that are fun to participate in such as hockey games and slope day. The academics can be really....","Read 2088 reviews.","Overall Niche Grade: A+,","Acceptance Rate: 7%,","Net Price: $26,060,","SAT Range: 1470-1570,","Will you get in?","https://www.niche.com/colleges/cornell-university/#scatterplot","Compare","https://www.niche.com/colleges/compare/?type=college&colleges=cornell-university","Virtual tour","https://blogs.cornell.edu/admissions/information-session/","Add to List"
"https://www.niche.com/colleges/university-of-chicago/","#23 Best Colleges in America","University of Chicago","Chicago, IL","·","4 Year","Rating 3.82 out of 5","1,300 reviews","I enjoyed my time at Hyde Park! I thought that the school challenged me strongly and prepared me well for post-college life.  The curriculum was thoughtful and the range of classes to take outside of my major was diverse.   The campus is beautiful and well-maintained and easy to get around.  Given the location, the school takes security very seriously and the UCPD is well-versed in the neighborhood and addresses it accordingly.  I know it's referred to as ""where fun goes to die"" but the students make their own fun! And having the city of Chicago to enjoy is a large benefit as well.","Alum:","...","Read 1,300 reviews","A+","grade","Overall Niche Grade","Acceptance rate 5%","Net price $36,991","SAT range 1500-1580","#23 Best Colleges in America.","University of Chicago","Blue checkmark.","4 Year,","CHICAGO, IL,","1300 Niche users give it an average review of 3.8 stars.","Featured Review: Alum says","I enjoyed my time at Hyde Park! I thought that the school challenged me strongly and prepared me well for post-college life.  The curriculum was thoughtful and the range of classes to take outside of....","Read 1300 reviews.","Overall Niche Grade: A+,","Acceptance Rate: 5%,","Net Price: $36,991,","SAT Range: 1500-1580,","Will you get in?","https://www.niche.com/colleges/university-of-chicago/#scatterplot","Compare","https://www.niche.com/colleges/compare/?type=college&colleges=university-of-chicago","Virtual tour","https://collegeadmissions.uchicago.edu/visit#virtualtour","Add to List"
"https://www.niche.com/colleges/johns-hopkins-university/","#24 Best Colleges in America","Johns Hopkins University","Baltimore, MD","·","4 Year","Rating 3.68 out of 5","1,413 reviews","Overall, my undergraduate experience at Johns Hopkins was great. The academics were challenging without being destructive to student mental health and there were always numerous clubs, involvement opportunities, and events on campus to attend in my free time. It was easy to find research opportunities at the hospital and in general, the professors were very supportive. I do wish that I had seen more of JHU's involvement in local communities and would love to see the college work to give back more to local communities in the future.","Alum:","...","Read 1,413 reviews","A+","grade","Overall Niche Grade","Acceptance rate 7%","Net price $24,034","SAT range 1520-1570","#24 Best Colleges in America.","Johns Hopkins University","Blue checkmark.","4 Year,","BALTIMORE, MD,","1413 Niche users give it an average review of 3.7 stars.","Featured Review: Alum says","Overall, my undergraduate experience at Johns Hopkins was great. The academics were challenging without being destructive to student mental health and there were always numerous clubs, involvement....","Read 1413 reviews.","Overall Niche Grade: A+,","Acceptance Rate: 7%,","Net Price: $24,034,","SAT Range: 1520-1570,","Will you get in?","https://www.niche.com/colleges/johns-hopkins-university/#scatterplot","Compare","https://www.niche.com/colleges/compare/?type=college&colleges=johns-hopkins-university","Virtual tour","https://www.youvisit.com/tour/jhuhomewood/127180","Add to List"
"https://www.niche.com/colleges/claremont-mckenna-college/","#25 Best Colleges in America","Claremont McKenna College","Claremont, CA","·","4 Year","Rating 3.94 out of 5","434 reviews","Weather is great, Professors are really interested in your growth, and there are endless opportunities for on campus work and summer internships. The social life is nice even though you will probably be busy with work and school. I think that there is a place for everyone at CMC regardless of how long it will take you to find your people.","Junior:","...","Read 434 reviews","A+","grade","Overall Niche Grade","Acceptance rate 10%","Net price $28,701","SAT range 1440-1550","#25 Best Colleges in America.","Claremont McKenna College","Blue checkmark.","4 Year,","CLAREMONT, CA,","434 Niche users give it an average review of 3.9 stars.","Featured Review: Junior says","Weather is great, Professors are really interested in your growth, and there are endless opportunities for on campus work and summer internships. The social life is nice even though you will probably....","Read 434 reviews.","Overall Niche Grade: A+,","Acceptance Rate: 10%,","Net Price: $28,701,","SAT Range: 1440-1550,","Will you get in?","https://www.niche.com/colleges/claremont-mckenna-college/#scatterplot","Compare","https://www.niche.com/colleges/compare/?type=college&colleges=claremont-mckenna-college","","","Add to List"